

================================================================
== Vitis HLS Report for 'DNN_Pipeline_VITIS_LOOP_150_10'
================================================================
* Date:           Fri Jun  2 02:54:13 2023

* Version:        2021.1 (Build 3247384 on Thu Jun 10 19:36:33 MDT 2021)
* Project:        DNN
* Solution:       solution1 (Vivado IP Flow Target)
* Product family: zynq
* Target device:  xc7z020-clg400-1


================================================================
== Performance Estimates
================================================================
+ Timing: 
    * Summary: 
    +--------+----------+-----------+------------+
    |  Clock |  Target  | Estimated | Uncertainty|
    +--------+----------+-----------+------------+
    |ap_clk  |  30.00 ns|  21.137 ns|     8.10 ns|
    +--------+----------+-----------+------------+

+ Latency: 
    * Summary: 
    +---------+---------+----------+----------+-----+-----+---------+
    |  Latency (cycles) |  Latency (absolute) |  Interval | Pipeline|
    |   min   |   max   |    min   |    max   | min | max |   Type  |
    +---------+---------+----------+----------+-----+-----+---------+
    |       23|       23|  0.690 us|  0.690 us|   23|   23|       no|
    +---------+---------+----------+----------+-----+-----+---------+

    + Detail: 
        * Instance: 
        N/A

        * Loop: 
        +---------------------+---------+---------+----------+-----------+-----------+------+----------+
        |                     |  Latency (cycles) | Iteration|  Initiation Interval  | Trip |          |
        |      Loop Name      |   min   |   max   |  Latency |  achieved |   target  | Count| Pipelined|
        +---------------------+---------+---------+----------+-----------+-----------+------+----------+
        |- VITIS_LOOP_150_10  |       21|       21|         4|          2|          1|    10|       yes|
        +---------------------+---------+---------+----------+-----------+-----------+------+----------+

============================================================
+ Verbose Summary: Synthesis Manager
============================================================
InlineROM: 1
ExposeGlobal: 0
============================================================
+ Verbose Summary: CDFG Model
============================================================
IsTopModel: 0
ResetActiveHigh: 1
IsCombinational: 0
IsDatapathOnly: 0
HasWiredReturn: 1
HasMFsm: 2
HasVarLatency: 1
IsPipeline: 0
IsRtlPipelined: 0
IsInstanceOverlapped: 0
IsDontTouch: 0
HasImplIP: 0
IsGatedGlobalClock: 0

+ Individual pipeline summary: 
  * Pipeline-0: initiation interval (II) = 2, depth = 4


============================================================
+ Verbose Summary: Schedule
============================================================
* Number of FSM states : 4
* Pipeline : 1
  Pipeline-0 : II = 2, D = 4, States = { 1 2 3 4 }
* Dataflow Pipeline: 0

* FSM state transitions: 
1 --> 2 
2 --> 3 
3 --> 4 
4 --> 

* FSM state operations: 

State 1 <SV = 0> <Delay = 3.32>
ST_1 : Operation 7 [1/1] (0.00ns)   --->   "%s = alloca i32 1"   --->   Operation 7 'alloca' 's' <Predicate = true> <Delay = 0.00>
ST_1 : Operation 8 [1/1] (0.00ns)   --->   "%i = alloca i32 1"   --->   Operation 8 'alloca' 'i' <Predicate = true> <Delay = 0.00>
ST_1 : Operation 9 [1/1] (1.58ns)   --->   "%store_ln0 = store i4 0, i4 %i"   --->   Operation 9 'store' 'store_ln0' <Predicate = true> <Delay = 1.58>
ST_1 : Operation 10 [1/1] (1.58ns)   --->   "%store_ln0 = store i32 0, i32 %s"   --->   Operation 10 'store' 'store_ln0' <Predicate = true> <Delay = 1.58>
ST_1 : Operation 11 [1/1] (0.00ns)   --->   "%br_ln0 = br void %.preheader2"   --->   Operation 11 'br' 'br_ln0' <Predicate = true> <Delay = 0.00>
ST_1 : Operation 12 [1/1] (0.00ns)   --->   "%i_3 = load i4 %i" [DNN.cpp:150]   --->   Operation 12 'load' 'i_3' <Predicate = true> <Delay = 0.00>
ST_1 : Operation 13 [1/1] (0.00ns)   --->   "%specpipeline_ln0 = specpipeline void @_ssdm_op_SpecPipeline, i32 4294967295, i32 0, i32 1, i32 0, void @p_str"   --->   Operation 13 'specpipeline' 'specpipeline_ln0' <Predicate = true> <Delay = 0.00>
ST_1 : Operation 14 [1/1] (1.30ns)   --->   "%icmp_ln150 = icmp_eq  i4 %i_3, i4 10" [DNN.cpp:150]   --->   Operation 14 'icmp' 'icmp_ln150' <Predicate = true> <Delay = 1.30> <CoreInst = "Cmp">   --->   Core 9 'Cmp' <Latency = 0> <II = 1> <Delay = 1.30> <FuncUnit> <Opcode : 'icmp'> <InPorts = 2> <OutPorts = 1>
ST_1 : Operation 15 [1/1] (0.00ns)   --->   "%empty = speclooptripcount i32 @_ssdm_op_SpecLoopTripCount, i64 10, i64 10, i64 10"   --->   Operation 15 'speclooptripcount' 'empty' <Predicate = true> <Delay = 0.00>
ST_1 : Operation 16 [1/1] (1.73ns)   --->   "%add_ln150 = add i4 %i_3, i4 1" [DNN.cpp:150]   --->   Operation 16 'add' 'add_ln150' <Predicate = true> <Delay = 1.73> <CoreInst = "Adder">   --->   Core 1 'Adder' <Latency = 0> <II = 1> <Delay = 1.73> <FuncUnit> <Opcode : 'add' 'sub'> <InPorts = 2> <OutPorts = 1>
ST_1 : Operation 17 [1/1] (0.00ns)   --->   "%br_ln150 = br i1 %icmp_ln150, void %.split4, void %.preheader1.preheader.exitStub" [DNN.cpp:150]   --->   Operation 17 'br' 'br_ln150' <Predicate = true> <Delay = 0.00>
ST_1 : Operation 18 [1/1] (0.00ns)   --->   "%i_6_cast = zext i4 %i_3" [DNN.cpp:150]   --->   Operation 18 'zext' 'i_6_cast' <Predicate = (!icmp_ln150)> <Delay = 0.00>
ST_1 : Operation 19 [1/1] (0.00ns)   --->   "%temp_output_addr = getelementptr i32 %temp_output, i64 0, i64 %i_6_cast" [DNN.cpp:151]   --->   Operation 19 'getelementptr' 'temp_output_addr' <Predicate = (!icmp_ln150)> <Delay = 0.00>
ST_1 : Operation 20 [2/2] (2.32ns)   --->   "%temp_output_load = load i4 %temp_output_addr" [DNN.cpp:151]   --->   Operation 20 'load' 'temp_output_load' <Predicate = (!icmp_ln150)> <Delay = 2.32> <CoreInst = "RAM">   --->   Core 82 'RAM' <Latency = 1> <II = 1> <Delay = 2.32> <Storage> <Opcode : 'load' 'store'> <Ports = 2> <Width = 32> <Depth = 10> <RAM>
ST_1 : Operation 21 [1/1] (1.58ns)   --->   "%store_ln150 = store i4 %add_ln150, i4 %i" [DNN.cpp:150]   --->   Operation 21 'store' 'store_ln150' <Predicate = (!icmp_ln150)> <Delay = 1.58>

State 2 <SV = 1> <Delay = 21.1>
ST_2 : Operation 22 [1/1] (0.00ns)   --->   "%s_load = load i32 %s" [DNN.cpp:151]   --->   Operation 22 'load' 's_load' <Predicate = (!icmp_ln150)> <Delay = 0.00>
ST_2 : Operation 23 [1/2] (2.32ns)   --->   "%temp_output_load = load i4 %temp_output_addr" [DNN.cpp:151]   --->   Operation 23 'load' 'temp_output_load' <Predicate = (!icmp_ln150)> <Delay = 2.32> <CoreInst = "RAM">   --->   Core 82 'RAM' <Latency = 1> <II = 1> <Delay = 2.32> <Storage> <Opcode : 'load' 'store'> <Ports = 2> <Width = 32> <Depth = 10> <RAM>
ST_2 : Operation 24 [3/3] (18.8ns)   --->   "%s_1 = fadd i32 %s_load, i32 %temp_output_load" [DNN.cpp:151]   --->   Operation 24 'fadd' 's_1' <Predicate = (!icmp_ln150)> <Delay = 18.8> <CoreInst = "FAddSub_fulldsp">   --->   Core 18 'FAddSub_fulldsp' <Latency = 2> <II = 1> <Delay = 18.8> <FuncUnit> <Opcode : 'fadd' 'fsub'> <InPorts = 2> <OutPorts = 1>
ST_2 : Operation 30 [1/1] (0.00ns)   --->   "%s_load_1 = load i32 %s"   --->   Operation 30 'load' 's_load_1' <Predicate = (icmp_ln150)> <Delay = 0.00>
ST_2 : Operation 31 [1/1] (0.00ns)   --->   "%write_ln0 = write void @_ssdm_op_Write.ap_auto.floatP0A, i32 %s_out, i32 %s_load_1"   --->   Operation 31 'write' 'write_ln0' <Predicate = (icmp_ln150)> <Delay = 0.00>
ST_2 : Operation 32 [1/1] (0.00ns)   --->   "%ret_ln0 = ret"   --->   Operation 32 'ret' 'ret_ln0' <Predicate = (icmp_ln150)> <Delay = 0.00>

State 3 <SV = 2> <Delay = 18.8>
ST_3 : Operation 25 [2/3] (18.8ns)   --->   "%s_1 = fadd i32 %s_load, i32 %temp_output_load" [DNN.cpp:151]   --->   Operation 25 'fadd' 's_1' <Predicate = true> <Delay = 18.8> <CoreInst = "FAddSub_fulldsp">   --->   Core 18 'FAddSub_fulldsp' <Latency = 2> <II = 1> <Delay = 18.8> <FuncUnit> <Opcode : 'fadd' 'fsub'> <InPorts = 2> <OutPorts = 1>

State 4 <SV = 3> <Delay = 20.4>
ST_4 : Operation 26 [1/1] (0.00ns)   --->   "%specloopname_ln150 = specloopname void @_ssdm_op_SpecLoopName, void @empty_3" [DNN.cpp:150]   --->   Operation 26 'specloopname' 'specloopname_ln150' <Predicate = true> <Delay = 0.00>
ST_4 : Operation 27 [1/3] (18.8ns)   --->   "%s_1 = fadd i32 %s_load, i32 %temp_output_load" [DNN.cpp:151]   --->   Operation 27 'fadd' 's_1' <Predicate = true> <Delay = 18.8> <CoreInst = "FAddSub_fulldsp">   --->   Core 18 'FAddSub_fulldsp' <Latency = 2> <II = 1> <Delay = 18.8> <FuncUnit> <Opcode : 'fadd' 'fsub'> <InPorts = 2> <OutPorts = 1>
ST_4 : Operation 28 [1/1] (1.58ns)   --->   "%store_ln151 = store i32 %s_1, i32 %s" [DNN.cpp:151]   --->   Operation 28 'store' 'store_ln151' <Predicate = true> <Delay = 1.58>
ST_4 : Operation 29 [1/1] (0.00ns)   --->   "%br_ln0 = br void %.preheader2"   --->   Operation 29 'br' 'br_ln0' <Predicate = true> <Delay = 0.00>


============================================================
+ Verbose Summary: Timing violations
============================================================
Target clock period: 30ns, clock uncertainty: 8.1ns.

 <State 1>: 3.32ns
The critical path consists of the following:
	'alloca' operation ('i') [4]  (0 ns)
	'load' operation ('i', DNN.cpp:150) on local variable 'i' [9]  (0 ns)
	'add' operation ('add_ln150', DNN.cpp:150) [13]  (1.74 ns)
	'store' operation ('store_ln150', DNN.cpp:150) of variable 'add_ln150', DNN.cpp:150 on local variable 'i' [22]  (1.59 ns)

 <State 2>: 21.1ns
The critical path consists of the following:
	'load' operation ('temp_output_load', DNN.cpp:151) on array 'temp_output' [20]  (2.32 ns)
	'fadd' operation ('s', DNN.cpp:151) [21]  (18.8 ns)

 <State 3>: 18.8ns
The critical path consists of the following:
	'fadd' operation ('s', DNN.cpp:151) [21]  (18.8 ns)

 <State 4>: 20.4ns
The critical path consists of the following:
	'fadd' operation ('s', DNN.cpp:151) [21]  (18.8 ns)
	'store' operation ('store_ln151', DNN.cpp:151) of variable 's', DNN.cpp:151 on local variable 's' [23]  (1.59 ns)


============================================================
+ Verbose Summary: Binding
============================================================
N/A
* FSMD analyzer results:
  - Output states:
 - Input state : 
  - Chain level:
	State 1
	State 2
	State 3
	State 4


============================================================
+ Verbose Summary: Datapath Resource usage 
============================================================
N/A
